<?xml version="1.0" encoding="UTF-8"?>
<map xmlns="http://prj-tuning.com/mapdef" xmlns:xsi="http://www.w3.org/2001/XMLSchema-instance"
	xsi:schemaLocation="http://prj-tuning.com/mapdef mapdef.xsd ">
	<id>KFLDHKO</id>
	<title>KFLDHKO - Overboost Correction</title>
	<pattern>9D 04 E7 F1 XX XX F7 F1 XX XX E6 F1 MMXX XX F2 F5 XX XX F2 F4 XX XX E0 XX DA</pattern>
	<conversion>
		<factor>1</factor>
		<signed>false</signed>
	</conversion>
 	<rowAxis>
		<id>PUV08</id>
	</rowAxis>
	<colAxis>
		<id>NISTV16</id>
	</colAxis>
</map>
